{
  "contains_flags": [
    "pork",
    "beef",
    "lamb",
    "poultry",
    "fish",
    "shellfish",
    "molluscs",
    "egg",
    "dairy",
    "gluten",
    "soy",
    "peanuts",
    "tree-nuts",
    "sesame",
    "mustard",
    "celery",
    "lupin",
    "sulphites",
    "alcohol",
    "caffeine",
    "added-sugar",
    "high-fodmap",
    "gelatin-non-halal",
    "gelatin-non-kosher",
    "honey"
  ],
  "compound_avoid_flags": {
    "vegan": [
      "pork",
      "beef",
      "lamb",
      "poultry",
      "fish",
      "shellfish",
      "molluscs",
      "egg",
      "dairy",
      "honey",
      "gelatin-non-halal",
      "gelatin-non-kosher"
    ],
    "vegetarian": [
      "pork",
      "beef",
      "lamb",
      "poultry",
      "fish",
      "shellfish",
      "molluscs",
      "gelatin-non-halal",
      "gelatin-non-kosher"
    ],
    "pescatarian": [
      "pork",
      "beef",
      "lamb",
      "poultry",
      "gelatin-non-halal"
    ],
    "halal": [
      "pork",
      "alcohol",
      "gelatin-non-halal"
    ],
    "kosher": [
      "pork",
      "shellfish",
      "molluscs",
      "gelatin-non-kosher"
    ],
    "low-fodmap": [
      "high-fodmap"
    ],
    "sugar-free": [
      "added-sugar"
    ],
    "lactose-free": [
      "dairy"
    ]
  },
  "attributes": {
    "effort": [
      "easy",
      "medium",
      "hard"
    ],
    "time_bucket": [
      "≤15",
      "≤30",
      "≤60",
      ">60"
    ],
    "calorie_bucket": [
      "≤400",
      "≤600",
      "≤800",
      ">800"
    ],
    "technique": [
      "bake",
      "sauté",
      "simmer",
      "raw",
      "grill",
      "fry",
      "steam",
      "roast",
      "broil",
      "pan-fry",
      "deep-fry",
      "stir-fry",
      "poach",
      "blanch"
    ]
  },
  "diet_options": [
    "classic",
    "vegan",
    "vegetarian",
    "pescatarian",
    "keto",
    "halal",
    "kosher",
    "gluten-free",
    "sugar-free",
    "low-fodmap",
    "lactose-free"
  ]
}
